{
  "contract_version": "prism-inference-v2.0",
  "baseline_id": "prism-v2-global-2026-09-30",
  "detector_model_sha256": "2e4e72d3ca040b15718ad6b09ae4ac3069c38f5c1a389327bf6b38c4e2903725",
  "recording_status": "EVENTS_DETECTED",
  "error": null,
  "input": {
    "sample_rate": 8000,
    "n_samples": 96000,
    "duration_s": 12.0,
    "input_domain": "reference_dataset",
    "recording_id": "rec2018-01-22_17h41m49.809s.wav",
    "recorded_at": "2018-01-22T17:41:49.809000"
  },
  "baseline_domain_validated": true,
  "feature_order": [
    "spectral_centroid_mean",
    "spectral_flatness_mean",
    "spectral_centroid_std",
    "spectral_rolloff_std"
  ],
  "n_events": 1,
  "n_scored": 1,
  "events": [
    {
      "event_id": 0,
      "start_time": 0.6880000000000001,
      "end_time": 2.232,
      "duration_s": 1.544,
      "detector_confidence": 0.9337995206608491,
      "detector_max_confidence": 0.9874169230461121,
      "window_count": 85,
      "status": "SCORE_ONLY",
      "not_scoreable_reasons": [],
      "anomaly_score": 0.5554649595904608,
      "feature_values": {
        "spectral_centroid_mean": 0.3786831498146057,
        "spectral_flatness_mean": 0.15679964423179626,
        "spectral_centroid_std": 0.039246752858161926,
        "spectral_rolloff_std": 0.06918291747570038
      },
      "feature_z_scores": {
        "spectral_centroid_mean": 0.2925679512070199,
        "spectral_flatness_mean": 0.8266781456279264,
        "spectral_centroid_std": -0.017166863112932456,
        "spectral_rolloff_std": -0.681819493421749
      },
      "mean_rms": 0.1774943321943283
    }
  ],
  "interpretation": "SCORE_ONLY: anomaly_score is the root-mean-square of robust z-scores of four spectral features relative to a frozen global baseline fitted on the reference dataset. It is a distance, not a probability, quality rating, NORMAL/ANOMALY decision or clinical assessment. No threshold is defined."
}
